{
  "$schema": "https://raw.githubusercontent.com/bytefolk/digital-employee/main/configs/employee-package.schema.json",
  "schemaVersion": "employee-package.v1alpha1",
  "name": "employee",
  "version": "0.1.0",
  "description": "A portable read-only employee that answers from approved knowledge.",
  "license": "Apache-2.0",
  "authors": [
    "fullstack-ai-infra"
  ],
  "host": {
    "protocol": "agent-host.v1",
    "requiredCapabilities": [
      "mcp"
    ]
  },
  "entrypoints": {
    "skill": "./SKILL.md",
    "inputSchema": "./schemas/input.schema.json",
    "outputSchema": "./schemas/output.schema.json",
    "mcp": "./mcp.json"
  },
  "policy": {
    "mode": "read_only",
    "network": "deny",
    "filesystem": {
      "read": [
        "./knowledge/**"
      ],
      "write": []
    },
    "mcpTools": [
      {
        "name": "mem.recall",
        "requestedMode": "read"
      },
      {
        "name": "doc.read",
        "requestedMode": "read"
      }
    ]
  },
  "assets": [
    "./knowledge/README.md",
    "./evals/cases.json"
  ]
}
