{
  "$schema": "https://raw.githubusercontent.com/bytefolk/digital-employee/main/configs/employee-package.schema.json",
  "schemaVersion": "employee-package.v1alpha1",
  "name": "pr-merger",
  "version": "0.1.0",
  "description": "在「评审身份已批准 + 必需检查针对该 head 全绿」的前提下 squash 合并他人的 PR；不写代码、不提 PR、不批准任何 PR。",
  "license": "Apache-2.0",
  "authors": [
    "bytefolk"
  ],
  "host": {
    "protocol": "agent-host.v1",
    "requiredCapabilities": []
  },
  "entrypoints": {
    "skill": "./SKILL.md",
    "inputSchema": "./schemas/input.schema.json",
    "outputSchema": "./schemas/output.schema.json"
  },
  "policy": {
    "mode": "approval_required",
    "network": "host_policy",
    "filesystem": {
      "read": [
        "./knowledge/**",
        "./context/**"
      ],
      "write": []
    },
    "mcpTools": []
  },
  "assets": [
    "./knowledge/README.md",
    "./evals/cases.json",
    "./permissions.json"
  ]
}
