{
  "$schema": "https://raw.githubusercontent.com/bytefolk/digital-employee/main/configs/employee-package.schema.json",
  "schemaVersion": "employee-package.v1alpha1",
  "name": "minimal-answer",
  "version": "0.1.0",
  "description": "A portable read-only employee that answers from approved knowledge.",
  "license": "Apache-2.0",
  "authors": [
    "fullstack-ai-infra"
  ],
  "host": {
    "protocol": "agent-host.v1",
    "requiredCapabilities": []
  },
  "entrypoints": {
    "skill": "./SKILL.md",
    "inputSchema": "./schemas/input.schema.json",
    "outputSchema": "./schemas/output.schema.json"
  },
  "policy": {
    "mode": "read_only",
    "network": "deny",
    "filesystem": {
      "read": [
        "./knowledge/**"
      ],
      "write": []
    },
    "mcpTools": []
  },
  "assets": [
    "./knowledge/README.md",
    "./evals/cases.json"
  ]
}
